{
  "schema_version": "TaskCatalog.v1",
  "catalog_id": "exam-checker-tasks-v1",
  "created_at": "2026-08-05T03:45:38.664511Z",
  "active_prompt_profile": "tuned",
  "canonical_schema_ref": "数据资产/schemas/v1/统一规范样本_第3版精简结构定义.json",
  "output_contract": {
    "top_level_fields": [
      "reason",
      "has_error",
      "total_errors",
      "errors"
    ],
    "error_fields": [
      "error_type",
      "position",
      "original_text",
      "anchor_text",
      "correction",
      "description",
      "suggestion"
    ]
  },
  "prompt_profiles": {
    "original": {
      "profile_id": "original",
      "bundle_separator": "\n\n",
      "shared_core": null,
      "json_contract": {
        "path": "提示词/JSON约束.txt",
        "content_sha256": "aa13101689625ea3d48f13d4b230ae798b0a56cce3b36052dc06e5408a75533d"
      }
    },
    "tuned": {
      "profile_id": "tuned",
      "bundle_separator": "\n",
      "shared_core": {
        "path": "提示词-微调版/共享核心.txt",
        "content_sha256": "1c440f0cb20307934389f67b50cd5a2e82be47de6a8cc35b44b4710f2abfdc20"
      },
      "json_contract": {
        "path": "提示词-微调版/JSON约束.txt",
        "content_sha256": "62daadeeb0190274cafa2ccc33d1d8e495eda155eb442acda8fd3cdacd22366d"
      }
    }
  },
  "dataset_categories": [
    "信息缺失",
    "德语",
    "日语",
    "标点符号错误",
    "法语",
    "答案泄露",
    "英语",
    "语义不清",
    "选项结构错误",
    "错别字",
    "题目与题型不一致",
    "题目无解"
  ],
  "tasks": [
    {
      "task_id": "typo_check",
      "display_name": "错别字",
      "task_card_name": "错别字",
      "default_dataset_category": "错别字",
      "language_scope": [
        "zh"
      ],
      "fixed_error_type": "错别字",
      "prompt_versions": {
        "original": {
          "task_card_version": "typo_check.original.v1",
          "rubric_version": "typo_check.original.rubric.v1",
          "task_card_path": "提示词/错别字.txt",
          "task_card_content_sha256": "fb2f731f41fa087cbbd6661877a7033a26d390cb2f53edbae17b8497979c6b91",
          "prompt_bundle_sha256": "ba904c94ad69850a9092328dd88a0f2d32a525fd4311f65125432b093f36bf1b"
        },
        "tuned": {
          "task_card_version": "typo_check.tuned.v1",
          "rubric_version": "typo_check.tuned.rubric.v1",
          "task_card_path": "提示词-微调版/错别字.txt",
          "task_card_content_sha256": "d4f43feede4caa64fb396e6bc70fca8ba933e2fdfafe19d743d0c771d3ce9bff",
          "prompt_bundle_sha256": "48aaaf44d68b495da5b2977351e89340e903cbc06a1c13a20c7c76b46f27f1a2"
        }
      }
    },
    {
      "task_id": "ambiguity_check",
      "display_name": "语义不清",
      "task_card_name": "语义不清",
      "default_dataset_category": "语义不清",
      "language_scope": [
        "zh"
      ],
      "fixed_error_type": "语义不清",
      "prompt_versions": {
        "original": {
          "task_card_version": "ambiguity_check.original.v1",
          "rubric_version": "ambiguity_check.original.rubric.v1",
          "task_card_path": "提示词/语义不清.txt",
          "task_card_content_sha256": "8b84f498fce3eae05e0b26be84faa7a918cc0b4d98fbb090ff2509d45663b512",
          "prompt_bundle_sha256": "8a72b5e8f8f2f8532abfdb5f7b1f9f2e969fff9d173d15df2bd97d8f7745c3bf"
        },
        "tuned": {
          "task_card_version": "ambiguity_check.tuned.v1",
          "rubric_version": "ambiguity_check.tuned.rubric.v1",
          "task_card_path": "提示词-微调版/语义不清.txt",
          "task_card_content_sha256": "f09bd5cbacd7f926bbeb20a450abb7749240cc1485608c99a0d1ebec579099cb",
          "prompt_bundle_sha256": "7c91765b4dabfc052d3b46ff2d78789d628c1e5e41332010188f547ddd4f6fe4"
        }
      }
    },
    {
      "task_id": "options_check",
      "display_name": "选项结构错误",
      "task_card_name": "选项结构错误",
      "default_dataset_category": "选项结构错误",
      "language_scope": [
        "zh"
      ],
      "fixed_error_type": "选项错误",
      "prompt_versions": {
        "original": {
          "task_card_version": "options_check.original.v1",
          "rubric_version": "options_check.original.rubric.v1",
          "task_card_path": "提示词/选项结构错误.txt",
          "task_card_content_sha256": "c6f7a714d60f06a8e778e567f1ac405b3d73e85e9e321138201905175bc0fac6",
          "prompt_bundle_sha256": "608986176bf5ccbf94f3012d5cf7fee190679b2e007d97c9f06b4a3bd73ed9aa"
        },
        "tuned": {
          "task_card_version": "options_check.tuned.v1",
          "rubric_version": "options_check.tuned.rubric.v1",
          "task_card_path": "提示词-微调版/选项结构错误.txt",
          "task_card_content_sha256": "e59056db89443f7237977d9c6ca2e43724f35cb70d545a24ebf42f74e7503b58",
          "prompt_bundle_sha256": "3a511f3bec8ca191ef410538416ddc158b50533ab4aed7f28030722851c83636"
        }
      }
    },
    {
      "task_id": "punctuation_check",
      "display_name": "标点符号错误",
      "task_card_name": "标点符号错误",
      "default_dataset_category": "标点符号错误",
      "language_scope": [
        "zh"
      ],
      "fixed_error_type": "标点符号",
      "prompt_versions": {
        "original": {
          "task_card_version": "punctuation_check.original.v1",
          "rubric_version": "punctuation_check.original.rubric.v1",
          "task_card_path": "提示词/标点符号错误.txt",
          "task_card_content_sha256": "29431f9e2cf54064bfc27b654f2b800512cfbe039c94323ae649d7342f6cf7f6",
          "prompt_bundle_sha256": "02c2543f0b4aa6acdfd6d321f668c7a4ef20b2f85bcae0eada1b20723d3e1cd4"
        },
        "tuned": {
          "task_card_version": "punctuation_check.tuned.v1",
          "rubric_version": "punctuation_check.tuned.rubric.v1",
          "task_card_path": "提示词-微调版/标点符号错误.txt",
          "task_card_content_sha256": "a2a389e9c0d15f62a17ee3e87e0ebdd64f7ba6fb2fb56be994695f01c038426b",
          "prompt_bundle_sha256": "efb78d62f4a4926b1e5e5940e7b65934da4bbec7965515ea4296eeefc391f982"
        }
      }
    },
    {
      "task_id": "missing_info_check",
      "display_name": "信息缺失",
      "task_card_name": "信息缺失",
      "default_dataset_category": "信息缺失",
      "language_scope": [
        "zh"
      ],
      "fixed_error_type": "信息缺失",
      "prompt_versions": {
        "original": {
          "task_card_version": "missing_info_check.original.v1",
          "rubric_version": "missing_info_check.original.rubric.v1",
          "task_card_path": "提示词/信息缺失.txt",
          "task_card_content_sha256": "dd9686e6fff0eb21326ca941fabaff43d568e7742070e74ed2ee1760be25d810",
          "prompt_bundle_sha256": "52176934c626fdf5ffb09ecf9e15ffa15d68c8050b27d36825c037ccab8f2cef"
        },
        "tuned": {
          "task_card_version": "missing_info_check.tuned.v1",
          "rubric_version": "missing_info_check.tuned.rubric.v1",
          "task_card_path": "提示词-微调版/信息缺失.txt",
          "task_card_content_sha256": "f440128292ebffaedc27e573e5047b7f2a5272f3029ddd05e9ceaa3e82d767f7",
          "prompt_bundle_sha256": "8a48bc01673b064cea85eac4e1af465e289a94d72ffd6c729eed713e7eb00145"
        }
      }
    },
    {
      "task_id": "question_type_mismatch_check",
      "display_name": "题目与题型不一致",
      "task_card_name": "题目与题型不一致",
      "default_dataset_category": "题目与题型不一致",
      "language_scope": [
        "zh"
      ],
      "fixed_error_type": "题目与题型不一致",
      "prompt_versions": {
        "original": {
          "task_card_version": "question_type_mismatch_check.original.v1",
          "rubric_version": "question_type_mismatch_check.original.rubric.v1",
          "task_card_path": "提示词/题目与题型不一致.txt",
          "task_card_content_sha256": "2719e24ff27d6912b4c1a936faf19ce21e4b32c414b9faed61a93a38a388c293",
          "prompt_bundle_sha256": "b2093a92bc75f3bea8acd487c61f8bcd5f77b4b0d1ad92345645b2bab7d8f712"
        },
        "tuned": {
          "task_card_version": "question_type_mismatch_check.tuned.v1",
          "rubric_version": "question_type_mismatch_check.tuned.rubric.v1",
          "task_card_path": "提示词-微调版/题目与题型不一致.txt",
          "task_card_content_sha256": "fa6709496e9802b7c67dc78a9da6db805314c25f9136d7498a3eadd7f27ed24d",
          "prompt_bundle_sha256": "ecd1511aa7c8e80e3ca096ec938b249cbf61fb05e24eef5e1d28e369c103088e"
        }
      }
    },
    {
      "task_id": "unsolvable_check",
      "display_name": "题目无解",
      "task_card_name": "题目无解",
      "default_dataset_category": "题目无解",
      "language_scope": [
        "zh"
      ],
      "fixed_error_type": "题目无解",
      "prompt_versions": {
        "original": {
          "task_card_version": "unsolvable_check.original.v1",
          "rubric_version": "unsolvable_check.original.rubric.v1",
          "task_card_path": "提示词/题目无解.txt",
          "task_card_content_sha256": "78a32fac985d20aa099d0ab2a2392a781993977b0a6450cf480175a9b2f23cdf",
          "prompt_bundle_sha256": "c041e4c616f5010395c847a4aeb886e17d0e5e582385304fada69f575e42c36b"
        },
        "tuned": {
          "task_card_version": "unsolvable_check.tuned.v1",
          "rubric_version": "unsolvable_check.tuned.rubric.v1",
          "task_card_path": "提示词-微调版/题目无解.txt",
          "task_card_content_sha256": "a890503f07817e88cd2500c1fa5ef78cca61606fd1cc22a8e0ad98a3ccf1573f",
          "prompt_bundle_sha256": "6bbde8ae12e1a13f1d1dc16c5670bdc35a5aa4e71df65082c68c0732de99d1a7"
        }
      }
    },
    {
      "task_id": "answer_leakage_check",
      "display_name": "答案泄露",
      "task_card_name": "答案泄露",
      "default_dataset_category": "答案泄露",
      "language_scope": [
        "zh"
      ],
      "fixed_error_type": "答案泄露",
      "prompt_versions": {
        "original": {
          "task_card_version": "answer_leakage_check.original.v1",
          "rubric_version": "answer_leakage_check.original.rubric.v1",
          "task_card_path": "提示词/答案泄露.txt",
          "task_card_content_sha256": "182178f68015d3d68a3403d2efa49e1f9b2f10efcfa2df4490879722b0aed5ad",
          "prompt_bundle_sha256": "a279df89bc21db248f04c1a4187505c09a0f80f01ea63dfda0e265c4388f0641"
        },
        "tuned": {
          "task_card_version": "answer_leakage_check.tuned.v1",
          "rubric_version": "answer_leakage_check.tuned.rubric.v1",